StartDate,EndDate,id,journal,author,doi,title,sci_cat,replic,hypo_tested,num_hyp,support,hyp1,hyp2,effect_size,clin_trial,prereg,prereg_link,data_state,open_data,animal,RCT,sig_level,sig_test,pval_sig,pval_type,rel_pval,sample_info,N,N_just,Team Leader Notes
4/13/21 9:02,4/13/21 9:09,Vanessa Yingling,MSSE,EAGLE,10.1249/MSS.0000000000001974,Shared Neuromuscular Performance Traits in Military Personnel with Prior Concussion,Clinical research,No,Yes,1,Full support,"it was hypothesized that military personnel who suffered a concussion within the previous 2 yr would demonstrate deficiencies in neuromuscular control parameters, such as muscular strength, time to peak torque, and single-leg landing strategies, with no difference in physiological outcomes relative to healthy controls with no concussion history.","As hypothesized, a majority of previously concussed warfighters in the current study (75%) presented with shared neuromuscular performance abnormalities that differentiated them from CONTROL (Fig. 1).",No,No,No,,No,,No,No,Yes,Yes,Yes,"Exact (e.g., p = .049)",,"Yes (e.g., total and group sample sizes provided) p values- unclear and vague significance references but they were there",48,No,"Sci_Cat MSSE choice, SH missed hyp, N was subset of larger dataset , Pval_sig resolved"
4/13/21 9:09,4/13/21 9:15,Vanessa Yingling,MSSE,SPRENGELER,10.1249/MSS.0000000000001948,Sports Contribute to Total Moderate to Vigorous Physical Activity in School Children,Epidemiology,No,No,,,,,Yes,No,No,,No,,No,No,No,,,,,"Yes (e.g., total and group sample sizes provided)",396,No,"Effect_size resolved, N based on flow diagram, VY agree no significance mentioned"
4/13/21 9:15,4/13/21 9:21,Vanessa Yingling,MSSE,BARRUÉ-BELOU,10.1249/MSS.0000000000002042,Supraspinal Control of Recurrent Inhibition during Anisometric Contractions,Applied exercise physiology (human),No,Yes,1,Unclear or not stated,"We hypothesized that the recurrent inhibition would increase during submaximal compared with maximal anisometric contractions, as previously observed during isometric contractions (24) while remaining higher during eccentric compared with isometric and concentric contractions because recurrent inhibition contributes to the depression in spinal excitability during eccentric MVC (21), and this depression has been reported at low and high forces (16)",unclear,Yes,No,No,,No,,No,No,Yes,Yes,Yes,"Relative (e.g., p < .05)",p <.05,"Yes (e.g., total and group sample sizes provided)",14,No,"Sci_Cat majority choice, Effect_size resolved, CRM missed hyp, Pval-resolved-SH not input"
4/13/21 9:22,4/13/21 9:29,Vanessa Yingling,MSSE,HOLMAN,10.1249/MSS.0000000000001975,Testosterone and Resistance Training Improve Muscle Quality in Spinal Cord Injury,Clinical research,No,Yes,1,Full support,Wehypothesized that NMES-RT would maximize the benefits of TRT on parameters of skeletal muscle quality observed in men with complete SCI.,The results indicate its effectiveness in improving muscle quality within an SCI population by increasing peak torque and muscle size while also improving contractile properties.,Yes,Yes,Yes,NCT01652040,No,,No,Yes,Yes,Yes,Yes,"Exact (e.g., p = .049)",,"Yes (e.g., total and group sample sizes provided)",22,No,"Effect_size resolved, Hyp- SH looking for “hypoth” in discussion, p<0.05 in figures but exact of figures in text so exact"
4/13/21 9:29,4/13/21 9:38,Vanessa Yingling,MSSE,LESZCZYNSKI,10.1249/MSS.0000000000002040,The Effect of Growth Restriction on Voluntary Physical Activity Engagement in Mice,Basic physiology (animal and cell physiology),No,Yes,1,Unclear or not stated,We hypothesize that these established mechanisms relating to the biological regulation of physical activity could elucidate processes by which growth restriction decreases physical activity engagement.,UNCLEAR,Yes,No,No,,No,,Yes,No,Yes,Yes,Yes,"Exact (e.g., p = .049)",,No (sample size(s) unclear/unreported),24,No,"Effect_size resolved, Hyp after discussion the ""established mechanisms"" were vague.  Pval_type verified exact, N=24 after much math in head so unclear sample info."
4/13/21 9:39,4/13/21 9:47,Vanessa Yingling,MSSE,MITCHELL,10.1249/MSS.0000000000001960,The Impact of Cycling Cadence on Respiratory and Hemodynamic Responses to Exercise,Applied exercise physiology (human),No,Yes,2,Full support,"we hypothesized thatV˙ O2,V˙ E, neural respiratory drive (estimated using crural diaphragmatic electromyography [EMGdi]), and the Wb would be greatest during the highest cadence conditions.","The main findings are as follows: (i) V˙ O2 and V˙E increased as a function of cadence, and were significantly elevated at 120 rpm; (ii) EMGdi and Wb were significantly greater at 120 rpm relative to lower cadences;",Yes,No,No,,No,,No,No,Yes,Yes,Yes,A mix: some exact and relative p-value(s),p <.05,"Yes (e.g., total and group sample sizes provided)",11,No,"Sci_Cat majority choice, Effect_size resolved, Vy missed an hyp, after discussion decided on full as EMGdi and Wb greater. N based on number in abstract, some exact p values in results text"
4/13/21 9:47,4/13/21 9:53,Vanessa Yingling,MSSE,MCCORMICK,10.1249/MSS.0000000000002026,The Impact of Morning versus Afternoon Exercise on Iron Absorption in Athletes,Applied exercise physiology (human),No,No,,,,,No,No,No,,No,,No,Yes,Yes,Yes,Yes,"Exact (e.g., p = .049)",,"Yes (e.g., total and group sample sizes provided)",16,No,P- resolved. P<0.05 in figures were exact in text
4/13/21 9:54,4/13/21 11:31,Vanessa Yingling,MSSE,SYVÄOJA,10.1249/MSS.0000000000002031,The Longitudinal Associations of Fitness and Motor Skills with Academic Achievement,Applied exercise physiology (human),No,Yes,1,Partial support,We predicted that changes in PF would be positively associated with changes in academic achievement and that PF components would independently predict future academic achievement,This 2-yr longitudinal study showed that changes in both aerobic andmuscular fitness were positively associated with changes in academic achievement during adolescence,Yes,No,No,,No,,No,No,Yes,Yes,Yes,A mix: some exact and relative p-value(s),p <.05,"Yes (e.g., total and group sample sizes provided)",970,No,"Sci_Cat MSSE choice, Effect_size resolved, Hyp agree on partial since future academic achievement not stated. N-resolved using number completed, Table 2 has 0.05 and no exact in text and Table 1 has exact"
4/13/21 11:32,4/13/21 11:38,Vanessa Yingling,MSSE,ZHANG,10.1249/MSS.0000000000002007,Transfer Learning Effects of Biofeedback Running Retraining in Untrained Conditions,Applied exercise physiology (human),No,Yes,1,Full support,"We hypothesized that such training protocol would facilitate the translation of the newly acquired gait pattern to the untrained extremity. After training, runners would be able to reduce the peak tibial shock in the untrained side, and during running at unconstrained speeds","Despite no biofeedback for the untrained limb, runners exhibited lower peak tibial shock bilaterally after gait retraining. In addition, participants managed to demonstrate the new gait pattern within 10% variance of their TS.",Yes,No,No,,No,,No,No,Yes,Yes,Yes,"Exact (e.g., p = .049)",,"Yes (e.g., total and group sample sizes provided)",13,Yes,"Sci_Cat majority choice, Hyp- SH looking for “hypoth” in discussion, exact confirmed and n justification, P<=0.002 is exact"
4/13/21 11:38,4/13/21 11:42,Vanessa Yingling,MSSE,ROUTLEDGE,10.1249/MSS.0000000000002052,Ultrasound Does Not Detect Acute Changes in Glycogen in Vastus Lateralis of Man,Applied exercise physiology (human),No,No,,,,,Yes,No,No,,No,,No,No,Yes,Yes,Yes,"Exact (e.g., p = .049)",,"Yes (e.g., total and group sample sizes provided)",14,No,"Effect_size resolved, N for study 1, RCT only for Exp 1, exact for study 1"
4/13/21 11:43,4/13/21 11:51,Vanessa Yingling,MSSE,MCKNIGHT,10.1249/MSS.0000000000001961,"V˙ O2peak, Body Composition, and Neck Strength of Elite Motor Racing Drivers",Applied exercise physiology (human),No,Yes,1,Unclear or not stated,We hypothesize that different auto racing series might stress physiological systems in different ways and therefore suggest a series-specific emphasis on key fitness variables for drivers and their coaching teams.,UNCLEAR,Yes,No,No,,No,,No,No,Yes,Yes,Yes,"Exact (e.g., p = .049)",,"Yes (e.g., total and group sample sizes provided)",18,No,"Sci_Cat MSSE choice, Effect_size resolved, Hyp agree unclear, CRM & VY coded as literal."
4/13/21 11:52,4/13/21 12:02,Vanessa Yingling,MSSE,KLEPIN,10.1249/MSS.0000000000002041,Validity of Cardiorespiratory Fitness Measured with Fitbit Compared toV˙ O2max,Applied exercise physiology (human),No,No,,,,,No,No,No,,No,,No,No,No,Yes,Yes,"Exact (e.g., p = .049)",,"Yes (e.g., total and group sample sizes provided), no indication of significance in methods or results but the word significant in discussion, exact based on p<0.001",60,No,"N-Final participant number after 5 drop outs, Clin_trial based on def agree, pvalue variables agreed after discussion"
4/19/21 5:04,4/19/21 5:09,Joe Warne,JSAMS,Csapo,10.1016/j.jsams.2018.06.014,"Fitness, knee function and competition performance in professional alpine skiers after ACL injury",Sport performance,No,No,,,,,Yes,No,No,,No,,No,No,Yes,Yes,Yes,A mix: some exact and relative p-value(s),p <.05,"Yes (e.g., total and group sample sizes provided)",46,No,P reported as >0.40
4/19/21 5:28,4/19/21 5:30,Joe Warne,JSAMS,Ekeland,10.1016/j.jsams.2018.07.011,Injuries among children and adults in alpine skiing and snowboarding,Epidemiology,No,No,,,,,No,No,No,,No,,No,No,Yes,Yes,Yes,"Exact (e.g., p = .049)",,"Yes (e.g., total and group sample sizes provided)",7695,No,
4/19/21 6:35,4/19/21 6:41,Joe Warne,JSAMS,Dickson,10.1016/j.jsams.2018.08.005,"Snowsport experience, expertise, lower limb injury andsomatosensory ability",Biomechanics,No,No,,,,,Yes,No,No,,No,,No,No,Yes,Yes,Yes,"Exact (e.g., p = .049)",,"Yes (e.g., total and group sample sizes provided)",75,No,
2/26/21 4:56,2/26/21 8:12,Joe Warne,JSAMS,Dickson,10.1016/j.jsams.2018.08.013,The King–Devick test is not sensitive to self-reported history ofconcussion but is affected by English language skill,Other,No,No,,,,,No,No,No,,No,,No,No,Yes,Yes,Yes,"Exact (e.g., p = .049)",,"Yes (e.g., total and group sample sizes provided)",75,No,
4/14/21 6:40,4/14/21 6:42,Joe Warne,JSAMS,Schindelwig,10.1016/j.jsams.2018.09.229,Safety recommendations of winter terrain park jumps into airbags,Biomechanics,No,No,,,,,No,No,No,,No,,No,No,No,,,,,"Yes (e.g., total and group sample sizes provided)",2,No,2 samples used in a model
3/1/21 9:20,3/1/21 9:30,Joe Warne,JSAMS,Ruedl,10.1016/j.jsams.2018.09.234,Impact of listening to music while wearing a ski helmet on soundsource localization,Motor learning/control/behavior,No,Yes,1,Full support,We hypothesized that theaccuracy of sound localization diminishes with increasing soundlevel.,Increasing the sound level of music resulted in a decrease of correctscores by about 10 percent points per 10 dB,Yes,No,No,,No,,No,No,Yes,Yes,Yes,"Exact (e.g., p = .049)",,"Yes (e.g., total and group sample sizes provided)",20,No,some languae may disprove but C agreed we needed to interepet only the authors conclusion
3/2/21 9:43,3/2/21 10:03,Joe Warne,JSAMS,Signetti,10.1016/j.jsams.2018.10.007,Modeling and simulation of the impact behavior of softpolymeric-foam-based back protectors for winter sports,Biomechanics,No,No,,,,,Yes,No,No,,No,,No,No,No,No,,,,No (sample size(s) unclear/unreported),,No,23% reported for ES
4/6/21 10:37,4/6/21 10:41,Joe Warne,JSAMS,Hasler,10.1016/j.jsams.2018.11.009,On the measurement of ski boot viscoelasticity,Biomechanics,No,No,,,,,Yes,No,No,,No,,No,No,Yes,No,,,,No (sample size(s) unclear/unreported),,No,
4/19/21 4:48,4/19/21 5:01,Joe Warne,JSAMS,Gamage,10.1016/j.jsams.2018.11.025,"Match injuries in Sri Lankan junior cricket: A prospective, longitudinal study",Epidemiology,No,No,,,,,No,No,No,,No,,No,No,No,,,,,"Yes (e.g., total and group sample sizes provided)",573,No,
2/26/21 2:40,2/26/21 4:56,Joe Warne,JSAMS,Scott,10.1016/j.jsams.2018.11.027,"The effect of 1,3-butanediol and carbohydrate supplementation on running performance",Applied exercise physiology (human),No,Yes,1,Partial support,It was hypothesised thatCHO + BD supplementation would increase blood ?HB concentrations and also enhance running performance.,"The present study demonstrated that CHO-BD supplementation did not improve 5 km TT performance compared to anenergy matched carbohydrate drink. However, CHO-BD did acutelyincrease blood ?HB concentrations higher than those observedwhen supplementing with medium-chain triacylglycerol19andketone salts,",Yes,No,No,,No,,No,No,Yes,Yes,Yes,A mix: some exact and relative p-value(s),p <.05,"Yes (e.g., total and group sample sizes provided)",11,No,missed
4/12/21 14:06,4/12/21 14:12,Joe Warne,JSAMS,Ludyga,10.1016/j.jsams.2018.11.029,Effects of a school-based physical activity program on retinal microcirculation and cognitive function in adolescents,Other,No,Yes,2,Full support,"Based on cross-sectional evidence, we expected that childrenin the exercise compared to the control group would show widerretinal arteriolar diameters7,8and increased inhibitory control16–18following the intervention period.","A structured aerobic and coordinative exercise program imple-mented in the school recess leads to a widening of the retinalarteriolar diameters, indicating a favorable change of microvascu-lar health in adolescents. Beyond the cardiovascular benefits, thischange is associated with an improvement of inhibitory control",Yes,No,No,,No,,No,Yes,Yes,Yes,Yes,A mix: some exact and relative p-value(s),p <.05,"Yes (e.g., total and group sample sizes provided)",35,Yes,"v vague language in duscussion, so unsure of of support - went to senior review"
4/19/21 5:50,4/19/21 5:54,Joe Warne,JSAMS,Leventer,10.1016/j.jsams.2018.12.001,Intra-seasonal variation of injury patterns among German Bundesliga soccer players,Epidemiology,No,Yes,1,Full support,An interaction term was added to test the hypothesisif the pattern of IRs throughout the season periods were signif-icantly different across different injury types.,"A significant interaction effect between seasonperiod and injury type was found among match injuries (X2= 20.3,df = 10, p &lt; 0.05).",Yes,No,No,,No,,No,No,Yes,Yes,Yes,A mix: some exact and relative p-value(s),p < .01,Partial (some information missing),1448,No,odds ratio was an ES
4/19/21 4:44,4/19/21 4:48,Joe Warne,JSAMS,Kingsley,10.1016/j.jsams.2018.12.003,Wrist-specific accelerometry methods for estimating free-living physical activity,Other,No,No,,,,,Yes,No,No,,No,,No,No,Yes,Yes,Yes,A mix: some exact and relative p-value(s),p < .001,"Yes (e.g., total and group sample sizes provided)",110,No,
4/8/21 7:08,4/8/21 7:12,Joe Warne,JSAMS,Aguilar-Farias,10.1016/j.jsams.2018.12.004,How many days are enough for measuring weekly activity behaviours with the ActivPAL in adults?,Other,No,No,,,,,Yes,No,No,,No,,No,No,Yes,Yes,Yes,"Exact (e.g., p = .049)",,"Yes (e.g., total and group sample sizes provided)",90,No,
4/8/21 7:12,4/8/21 7:16,Joe Warne,JSAMS,Sekiguchi,10.1016/j.jsams.2018.12.005,Factors influencing hydration status during a National Collegiate Athletics Association division 1 soccer preseason,"Environmental physiology (heat, cold, & altitude)",No,No,,,,,Yes,No,No,,No,,No,No,Yes,Yes,Yes,A mix: some exact and relative p-value(s),p < .001,"Yes (e.g., total and group sample sizes provided)",28,No,"yes, but sample sizes for all group sessions not reported? - This is a limitation of sample size reporting"
4/12/21 14:12,4/12/21 14:16,Joe Warne,JSAMS,Tomaz,10.1016/j.jsams.2018.12.009,Gross motor skills of South African preschool-aged children across different income settings,Motor learning/control/behavior,No,No,,,,,Yes,No,No,,No,,No,No,Yes,Yes,Yes,A mix: some exact and relative p-value(s),p <.05,"Yes (e.g., total and group sample sizes provided)",259,No,
4/19/21 5:31,4/19/21 5:50,Joe Warne,JSAMS,Bennett,10.1016/j.jsams.2018.12.011,Assessing the validity of a video-based decision-making assessment for talent identification in youth soccer,Motor learning/control/behavior,No,Yes,5,Partial support,It was hypothesisedthat older players would have superior decision-making perfor-mances (i.e. a higher response accuracy and a faster responsetime) when compared with younger players,"As hypoth-esised, the older players were faster at responding in eachsituation, when compared with their younger counterparts.",Yes,No,No,,No,,No,No,Yes,Yes,Yes,A mix: some exact and relative p-value(s),p <.05,"Yes (e.g., total and group sample sizes provided)",387,No,contorl AND int group
4/19/21 8:22,4/19/21 8:35,Joe Warne,JSAMS,Cobley,10.1016/j.jsams.2018.12.013,Removing relative age effects from youth swimming: The development and testing of corrective adjustment procedures,Sport performance,No,No,,,,,Yes,No,No,,No,,No,No,Yes,Yes,Yes,A mix: some exact and relative p-value(s),p < .001,"Yes (e.g., total and group sample sizes provided)",553,No,Used sample from the main research question
4/19/21 4:28,4/19/21 4:39,Joe Warne,JSAMS,McKay,10.1016/j.jsams.2018.12.015,Acute carbohydrate ingestion does not influence the post-exercise iron-regulatory response in elite keto-adapted race walkers,Applied exercise physiology (human),No,No,,,,,No,No,No,,No,,No,No,Yes,Yes,Yes,"Exact (e.g., p = .049)",,"Yes (e.g., total and group sample sizes provided)",23,No,A significant ∼5 to 10-fold increase  - this was agreed to be too vague for an ES
4/19/21 8:42,4/19/21 8:50,Joe Warne,JSAMS,Altenburg,10.1016/j.jsams.2018.12.016,Standing is not enough: A randomized crossover study on the acute cardiometabolic effects of variations in sitting in healthy young men,Clinical research,No,No,,,,,Yes,Yes,Yes,NTRcode 5723,No,,No,No,Yes,Yes,Yes,A mix: some exact and relative p-value(s),p <.05,"Yes (e.g., total and group sample sizes provided)",20,Yes,Beta coeficient agreed to be ES
4/8/21 10:06,4/8/21 10:12,Joe Warne,JSAMS,Horwath,10.1016/j.jsams.2018.12.017,Isokinetic resistance training combined with eccentric overload improves athletic performance and induces muscle hypertrophy in young ice hockey players,Sport performance,No,Yes,1,Partial support,"We hypothesizedthat multiple-joint isokinetic RT and eccentric overload would elicitgreater increases in strength, power and muscle hypertrophy com-pared to traditional RT","The major finding presented herein was that the combination ofisokinetic RT and eccentric overload induced greater muscle hyper-trophy compared to traditional RT. The results also show that thistype of training improves drop jump performance, whereas gainsin maximal strength and power output were similar across trainingmodalities",Yes,No,No,,No,,No,Yes,Yes,Yes,Yes,A mix: some exact and relative p-value(s),p <.01,"Yes (e.g., total and group sample sizes provided)",22,No,missed relative p
4/19/21 5:01,4/19/21 5:04,Joe Warne,JSAMS,Chambers,10.1016/j.jsams.2019.01.001,Automatic detection of one-on-one tackles and ruck events using microtechnology in rugby union,Biomechanics,No,Yes,1,Full support,"It was hypothesised that using the accelerometer,magnetometer and gyroscope data provided, an algorithm couldbe developed to automate detection of tackles and rucks in rugbyunion",Results demonstrate thatruck and tackle events can be correctly detected when applyinga specifically-designed algorithm to microtechnology data dur-ing international match-play.,No,No,No,,No,,No,No,No,,,,,"Yes (e.g., total and group sample sizes provided)",12,No,
4/12/21 13:57,4/12/21 14:02,Joe Warne,JSAMS,Fuchs,10.1016/j.jsams.2019.01.002,Movement characteristics of volleyball spike jump performance in females,Biomechanics,No,Yes,1,Partial support,A sufficient number of correla-tions to reliably (R2&gt; 0.7) predict jump height and ball velocity washypothesised.,UNCLEAR,Yes,No,No,,No,,No,No,Yes,Yes,Yes,A mix: some exact and relative p-value(s),p <.01,"Yes (e.g., total and group sample sizes provided)",15,No,
4/16/21 8:37,4/16/21 8:42,Joe Warne,JSAMS,Carson,10.1016/j.jsams.2019.01.003,Associations between meeting the Canadian 24-Hour Movement Guidelines for the Early Years and behavioral and emotional problems among 3-year-olds,Motor learning/control/behavior,No,Yes,2,Full support,We hypothesized that children meeting more recom-mendations within the guidelines would have fewer behavioral andemotional problems,Children meeting more recommendationswithin the guidelines had lower behavioral and emotional prob-lems as measured by the CBCL.,Yes,No,No,,No,,No,No,Yes,Yes,Yes,"Exact (e.g., p = .049)",,"Yes (e.g., total and group sample sizes provided)",539,No,2 hypothesis but in one sentence
4/19/21 8:35,4/19/21 8:42,Joe Warne,JSAMS,Northey,10.1016/j.jsams.2019.01.004,Can the intensity of physical activity be accurately measured in older adults using questionnaires?,Epidemiology,No,No,,,,,Yes,No,No,,No,,No,No,Yes,Yes,Yes,A mix: some exact and relative p-value(s),p <.01,"Yes (e.g., total and group sample sizes provided)",169,No,
4/19/21 6:54,4/19/21 8:22,Joe Warne,JSAMS,Renoux,10.1016/j.jsams.2019.01.007,Ultrasound-detected connective tissue involvement in acute muscle injuries in elite athletes and return to play: The French National Institute of Sports (INSEP) study,Applied exercise physiology (human),No,Yes,2,Partial support,We tested the hypothesis thatmuscle injuries exhibiting connective tissue involvement are asso-ciated with longer recovery times when compared to those withoutsuch involvement,"Furthermore, considering only thetype of injury, we found that recovery times were longer for athletesexhibiting C injuries in comparison with those having M injuries ingeneral. However, when specifically comparing the same gradesfrom different types of injury (2M vs. 2C and 3M vs. 3C), no signifi-cant differences were found in the time needed to RTP.",No,No,No,,No,,No,No,Yes,Yes,Yes,A mix: some exact and relative p-value(s),p < .01,"Yes (e.g., total and group sample sizes provided)",70,No,ES - kappa? Are we only interested in ES for the main analysis?? For any mention of ES?
4/7/21 8:07,4/7/21 8:11,Joe Warne,JSAMS,Miles,10.1016/j.jsams.2019.01.008,Sleep practices implemented by team sport coaches and sports science support staff: A potential avenue to improve athlete sleep?,Other,No,No,,,,,No,No,No,,No,,No,No,Yes,Yes,Yes,A mix: some exact and relative p-value(s),p <.05,"Yes (e.g., total and group sample sizes provided)",86,No,
4/19/21 4:39,4/19/21 4:44,Joe Warne,JSAMS,Duhig,10.1016/j.jsams.2019.01.010,"Effect of concentric and eccentric hamstring training on sprint recovery, strength and muscle architecture in inexperienced athletes",Sport performance,No,Yes,1,Not supported,"We hypothesised that adaptationsinduced by eccentric training would, in comparison with concen-tric training, result in a better maintenance of sprint performancebetween sessions and reduced markers of muscle damage (passivehamstring torques, perceived muscle soreness and venous crea-tine kinase levels (CK))","Contrary to our hypothesisand despite significant between- group differences in BFLHfasciclelengths and PA before sprint session 1, there were no between-group differences for sprint performance decrements or markersof muscle damage",Yes,No,No,,No,,No,Yes,Yes,Yes,Yes,A mix: some exact and relative p-value(s),p < .10,"Yes (e.g., total and group sample sizes provided)",30,No,
4/12/21 14:21,4/12/21 14:25,Joe Warne,JSAMS,McIlvenna,10.1016/j.jsams.2019.01.011,Lower limb ischemic preconditioning combined with dietary nitrate supplementation does not influence time-trial performance in well-trained cyclists,Applied exercise physiology (human),No,Yes,1,Not supported,"We hypothesized that IPCcombined with dietary NO3−supplementation would result in acumulative rise in plasma NO2−and improve muscle oxygenation,·VO2kinetics, and exercise performance compared to a control orIPC alone.","In contrast to our hypothesis, IPCcombined with NO3−supplementation increased the availabilityof plasma [NO2−] from baseline but did not improve·VO2kinet-ics or muscle oxygenation during submaximal exercise or enhancecycling time-trial performance.",Yes,No,No,,No,,No,No,Yes,Yes,Yes,"Exact (e.g., p = .049)",,"Yes (e.g., total and group sample sizes provided)",10,No,
4/19/21 4:15,4/19/21 4:19,Joe Warne,JSAMS,Diffendaffer,10.1016/j.jsams.2019.01.012,The influence of mound height on baseball movement and pitching biomechanics,Biomechanics,No,Yes,3,Not supported,"moundheight would affect the pitcher’s (1) ball movement (e.g., velocity,spin and break)","hypothesis that ball movement (velocity, spin, and break)would vary with mound height was not supported by the results.",No,No,No,,No,,No,No,Yes,Yes,Yes,"Exact (e.g., p = .049)",,"Yes (e.g., total and group sample sizes provided)",20,No,
4/9/21 9:21,4/9/21 9:25,Joe Warne,JSAMS,Lulinska-Kuklik,10.1016/j.jsams.2019.01.014,"Are MMP3, MMP8 and TIMP2 gene variants associated with anterior cruciate ligament rupture susceptibility?",Applied exercise physiology (human),No,No,,,,,Yes,No,No,,No,,No,No,Yes,Yes,Yes,"Exact (e.g., p = .049)",,"Yes (e.g., total and group sample sizes provided)",421,Yes,OR included ES
4/9/21 9:25,4/9/21 9:49,Joe Warne,JSAMS,Immler,10.1016/j.jsams.2019.01.015,Individual flexion stiffness of ski boots,Biomechanics,No,No,,,,,Yes,No,No,,No,,No,No,Yes,Yes,Yes,"Exact (e.g., p = .049)",,"Yes (e.g., total and group sample sizes provided)",135,No,135 was the sample used for the primary analysis
4/12/21 14:16,4/12/21 14:20,Joe Warne,JSAMS,Paing,10.1016/j.jsams.2019.01.017,Dose-response between frequency of breaks in sedentary time and glucose control in type 2 diabetes: A proof of concept study,Clinical research,No,No,,,,,No,Yes,No,,No,,No,Yes,Yes,Yes,Yes,A mix: some exact and relative p-value(s),p <.05,"Yes (e.g., total and group sample sizes provided)",12,Yes,
