StartDate,EndDate,id,journal,author,doi,title,sci_cat,replic,hypo_tested,num_hyp,support,hyp1,hyp2,effect_size,clin_trial,prereg,prereg_link,data_state,open_data,animal,RCT,sig_level,sig_test,pval_sig,pval_type,rel_pval,sample_info,N,N_just,Team Leader Notes
3/8/21 20:36,3/8/21 20:55,Rosie Twomey,EJSS,Zagatto,10.1080/17461391.2018.1546338,3-min all-out effort on cycle ergometer is valid to estimate the anaerobic capacity by measurement of blood lactate and excess post-exercise oxygen consumption,Applied exercise physiology (human),No,No,,,,,Yes,No,No,,No,,No,No,Yes,Yes,Yes,"Exact (e.g., p = .049)",,"Yes (e.g., total and group sample sizes provided)",11,No,"Recoded as exact - assumed the couple that were 2 dps ended in 0, considering all other p values are  3dp"
3/8/21 20:55,3/8/21 21:41,Rosie Twomey,EJSS,Douzi,10.1080/17461391.2018.1551937,3-min whole body cryotherapy/cryostimulation after training in the evening improves sleep quality in physically active men,Applied exercise physiology (human),No,Yes,1,Full support,"We assumed that a single exposure to whole body cryotherapy improves sleep quality after evening training and stimulates the reactivation of parasympathetic nervous activity. To verify this hypothesis, we examined the impact of 3-min whole body cryotherapy exposure on subjective and objective sleep quality and night HRV analysis following a standardized training session in physically active men.","The main findings was that a single session of whole- body cryotherapy (3-min at −40°C; wind speed at 2.3 m s−1) in the evening improves the subjective and objective sleep quality, enhances the reactivation of parasympathetic activity and reduces the perceived pain 24 h after a standardized exercise regimen in physically active men.",Yes,Yes,No,,No,,No,Yes,Yes,Yes,Yes,A mix: some exact and relative p-value(s),p <.01,"Yes (e.g., total and group sample sizes provided)",22,Yes,"Although this includes health outcomes, the intervention is looking at recovery from exercise (not a clear health outcome), so not coded as clinical trial. Agreed on randomized design (cross over). All agreed with RT on p values."
3/8/21 21:41,3/8/21 21:53,Rosie Twomey,EJSS,Abbott,10.1080/17461391.2019.1600586,"A season long investigation into the effects of injury, match selection and training load on mental wellbeing in professional under 23 soccer players: A team case study",Sport/exercise psychology,No,Yes,1,Partial support,"We hypothesized that injury, not being selected to play games and high training loads would negatively affect the players MW.","The main findings of this study were that time out injured and not being selected to play games significantly affected MW in a squad of under 23 professional soccer players during the course of a season. / Weekly training loads measured by GPS (total distance, sprint distance and total duration) and individual player win rate did not influence MW (P &gt; 0.05).",Yes,No,No,,No,,No,No,Yes,Yes,,A mix: some exact and relative p-value(s),p <.05,"Yes (e.g., total and group sample sizes provided)",25,No,RT agreed on sci_cat. RT confirmed p values.
3/8/21 21:54,3/8/21 22:05,Rosie Twomey,EJSS,Dalen,10.1080/17461391.2019.1566403,Accelerations – a new approach to quantify physical performance decline in male elite soccer?,Sport performance,No,No,,,,,Yes,No,No,,No,,No,No,Yes,Yes,Yes,"Relative (e.g., p < .05)",p < .001,"Yes (e.g., total and group sample sizes provided)",39,No,MW agreed to coding sample size as number of pts (to recognize as a limitation). Agree with RT on p values (higest precision).
3/9/21 22:27,3/9/21 22:44,Rosie Twomey,EJSS,Ribeiro,10.1080/17461391.2018.1500643,Acute effects of aerobic exercise performed with different volumes on strength performance and neuromuscular parameters,Applied exercise physiology (human),No,Yes,1,Partial support,We hypothesized that a high volume aerobic exercise will result in greater acute interference on maximum strength and strength-endurance performance as well as impairment in central drive.,"Partially contradicting our hypothesis, central drive (i.e. VA and RMS reductions) declined similarly after all aerobic exercises and remained reduced after the strength tests. / The main findings of this study were the following: a) strength-endurance performance (TV) was impaired by previous aerobic exercise in a volume-dependent manner,whilemaximumdynamic strength (1RM) performance was not affected by previous aerobic exercise; b) central drive declined similarly after all aerobic-exercises ",Yes,No,No,,No,,No,No,Yes,Yes,Yes,"Relative (e.g., p < .05)",p < .001,"Yes (e.g., total and group sample sizes provided)",21,No,All agree on Yes effect sizes and with RT on p values.
3/9/21 22:44,3/9/21 22:58,Rosie Twomey,EJSS,Page,10.1080/17461391.2019.1578417,Acute taurine supplementation enhances thermoregulation and endurance cycling performance in the heat,"Environmental physiology (heat, cold, & altitude)",No,Yes,1,Partial support,It was hypothesised that taurine would extend time to exhaustion in the heat and delay the rate of rise in core temperature by enhancing convective or evaporative cooling potential.,"The key findings were that time to exhaustion in the heat (35°C) increased by ∼10%...... Whilst there were no consistent differences in core and skin temperature between conditions during the earlier stages of the time to exhaustion, a lower core temperature was found during the final 10% of the trial and there was a trend for ""small"" reductions in skin temperature based on effect sizes. Whilst there were no consistent differences in core and skin temperature between conditions during the earlier stages of the time to exhaustion, a lower core temperature was found during the final 10% of the trial and there was a trend for ""small"" reductions in skin temperature based on effect sizes.",Yes,No,No,,No,,No,Yes,Yes,Yes,Yes,A mix: some exact and relative p-value(s),p < .001,"Yes (e.g., total and group sample sizes provided)",11,Yes,"Based on additional sentences, RT agreed on partial (related to the rate of increase in core temp). RCT agreed - Crossover trial. Use randomized designs in later reporting. Highest precision for relative p values (Chris agreed)."
3/9/21 22:58,3/9/21 23:11,Rosie Twomey,EJSS,Taylor,10.1080/17461391.2018.1527949,Alterations in core temperature during World Rugby Sevens Series tournaments in temperate and warm environments,Sport performance,No,Yes,2,Full support,It was hypothesized that (i) an accumulation (i.e. game-to-game increase) in Tc would occur on each tournament day,there were substantial game-on-game increases in mean Tc,Yes,No,No,,No,,No,No,No,,,,,"Yes (e.g., total and group sample sizes provided)",17,No,"WA agreed on 2 statements and full support based on review, coded sample size as pts for practical reasons."
3/9/21 23:11,3/9/21 23:21,Rosie Twomey,EJSS,Jewell,10.1080/17461391.2019.1575912,"Altered multi-muscle coordination patterns in habitual forefoot runners during a prolonged, exhaustive run",Motor learning/control/behavior,No,Yes,3,Full support,"From the beginning to end of this run, we hypothesized that: (1) there would be fatigue of the plantar flexors and thus a decrease in the total summed intensity of activation of the plantar flexor EMG;",The results of this study are in support of our primary hypothesis and suggests that forefoot runners experience a change in lower extremity muscle coordination patterns over the course of an exhaustive run,Yes,No,No,,No,,No,No,Yes,Yes,Yes,"Exact (e.g., p = .049)",,"Yes (e.g., total and group sample sizes provided)",13,Yes,
4/11/21 22:01,4/11/21 22:19,Rosie Twomey,EJSS,Harris,10.1080/17461391.2018.1560508,An external focus of attention promotes flow experience during simulated driving,Motor learning/control/behavior,No,Yes,2,Full support,"It was predicted, based on a range of previous work (McNevin et al., 2003; Wulf, 2013), that an external focus would promote improved performance, motor control and attention, and as a result, greater flow experience.","""In line with our primary hypothesis, external focus instructions lead to greater self-reported flow."" ""Similarly, there was no performance effect from instructions to focus externally, despite previous support in a range of tasks (Wulf, 2013)."" ""The external attentional focus manipulation was also predicted to increase automated motor control (steering wheel entropy) and visuomotor coordination (eye-steering coordination), but this hypothesis was not supported (cf. Wulf, 2013)."" """,Yes,No,No,,Yes,Yes,No,No,Yes,Yes,Yes,A mix: some exact and relative p-value(s),p < .001,"Yes (e.g., total and group sample sizes provided)",33,Yes,RT agreed full support based on the authors interpretation of the primary hypothesis being supported. Lack of support was interpreted as being related to the additional hypothesis statement. WA and CM agreed with open data. WA agreed on p values. WA and RT agree with Chris on sci_cat.
4/11/21 22:19,4/11/21 22:30,Rosie Twomey,EJSS,Hoenig,10.1080/17461391.2018.1519040,Analysis of running stability during 5000 m running,Biomechanics,No,Yes,2,Not supported,"With regard to literature (Asgari, Sanjari, & Esteki, 2017; Cignetti et al., 2009; Granata & Gottipati, 2008), our hypothesis was that local dynamic running stability (measured by the largest Lyapunov exponent λ) decreases during exercise due to fatigue.","Contrary to our hypothesis, the findings from this study suggest that thorax and pelvis LDS increases during exhaustive running.",Yes,No,No,,No,,No,No,Yes,Yes,Yes,"Exact (e.g., p = .049)",,"Yes (e.g., total and group sample sizes provided)",30,No,Recoded as exact.
4/11/21 22:31,4/11/21 22:48,Rosie Twomey,EJSS,MacKenzie-Shalders,10.1080/17461391.2018.1561951,Are increases in skeletal muscle mass accompanied by changes to resting metabolic rate in rugby athletes over a pre-season training period?,Applied exercise physiology (human),No,Yes,2,Full support,"It is hypothesised that measured RMR will be under-predicted by conventional equations based on body mass, due to the athletes’ higher relative contribution of lean mass to body mass, and thus RMR.","Both sampled BM-derived prediction equations i.e. Harris-Benedict 1 (Harris & Benedict, 1919) and Harris-Benedict 2 (Roza & Shizgal, 1984) and the LBM-derived Cunningham equation (Cunningham, 1991) using baseline data significantly underpredicted measured RMR at baseline and post preseason.",Yes,No,No,,No,,No,Yes,Yes,Yes,Yes,A mix: some exact and relative p-value(s),p < .001,"Yes (e.g., total and group sample sizes provided)",18,No,WA agreed on 2 statements and full support. CM agreed on p values. CM happy to agree on sample size - RT reiterated that a convenience sample is not a sample size justification with team leaders.
4/11/21 22:48,4/11/21 23:04,Rosie Twomey,EJSS,Chao,10.1080/17461391.2019.1595741,Association of electrocardiographic left and right ventricular hypertrophy with physical fitness of military males: The CHIEF study,Applied exercise physiology (human),No,Yes,1,Unclear or not stated,We hypothesize that the presence of ECG-LVH or ECG-RVH may reflect the exercise performance of well-trained military males.,"""Our principal findings were that military males with ECG-LVH tended to have better performance in the 3000-meter run compared to the unaffected males despite little practical relevance"". ""In addition, those males with ECG-RVH, who present more rapid resting heart rate and lower systolic blood pressure, tended to confer a 1.5-fold higher possibility of worse performance in the 2-minute sit-ups exercise.""",Yes,No,No,,No,,No,No,Yes,Yes,Yes,A mix: some exact and relative p-value(s),p < .001,"Yes (e.g., total and group sample sizes provided)",2587,No,"RT and WA agreed on unclear due to no direction in the hypothesis, vague wording of hypothesis, full support may be reading between the lines. WA happy with not coding supp material as a data statement. WA agreed with no sample size calc."
4/12/21 10:37,4/12/21 10:50,Rosie Twomey,EJSS,Hashizume,10.1080/17461391.2018.1539123,Between-limb differences in running technique induces asymmetric negative joint work during running,Biomechanics,No,Yes,1,Full support,"We hypothesized that the negative work is smaller for a particular side of the leg (inferior side) than the other side of the leg (superior side) for each lower extremity joint, and that the asymmetric negative work is induced by solely or combination of between-limb differences in the associated mechanical parameters.","These results support our initial hypotheses that the negative work is smaller for the inferior side than for the superior side for each lower extremity joint, and the asymmetric negative work is induced by solely or combination of between-limb differences in the associated mechanical parameters.",Yes,No,No,,No,,No,No,Yes,Yes,Yes,"Exact (e.g., p = .049)",,"Yes (e.g., total and group sample sizes provided)",25,No,"Code as exact (agree with WA). Discussion over the use of ""hypotheses"" by the authors in the discussion section. We all agreed that it could be justified either way. Team leaders also considered this a tough call. Fell to the original majority decision."
4/12/21 10:50,4/12/21 11:06,Rosie Twomey,EJSS,Touzard,10.1080/17461391.2018.1539527,Biomechanical analysis of the “waiter’s serve” on upper limb loads in young elite tennis players,Biomechanics,No,Yes,2,Partial support,We hypothesized to find lower serve velocities and/or higher upper limb joint loads for WS group compared to NS group.,"""In summary, this study identified the WS posture as a pathomechanical pattern in young elite tennis serve, involving higher upper limb joint kinetics with no effect on ball velocity."" ""the higher loadings recorded in the dominant upper limb in WS""",Yes,No,No,,No,,No,No,Yes,Yes,Yes,A mix: some exact and relative p-value(s),p < .001,"Yes (e.g., total and group sample sizes provided)",18,No,Their language indicates find some support while also acknowledging some outcomes to not support the hypothesis. The authors find some support. The vague hypothesis is unhelpful. All agreed on partial support. Pvalues agree with RT.
4/12/21 11:06,4/12/21 11:23,Rosie Twomey,EJSS,Lizondo,10.1080/17461391.2018.1563633,Bone quality in young adults with intellectual disability involved in adapted competitive football,Other,No,Yes,1,Full support,"Our hypothesis is that due to the different endocrine and hormonal characteristics of these 2 populations with ID (DS and non-DS), bone response to physical activity may be different and less obvious in individuals with DS.","The sub-analysis of the ID groups on the basis of aetiology (DS and non- DS) revealed 3 main findings: (1) Sedentary participants with non-DS ID showed worse bone quality (lower SOS, lower stiffness index, lower T-scores, and lower estimated BMD) than sedentary DS individuals; (2) there were no differences in the bone quality parameters between DS football players and sedentary DS participants; (3) ID non-DS football players displayed significantly better QUS parameters than their sedentary counterparts, reflecting a clear bone response to exercise.",Yes,No,No,,No,,Yes,No,Yes,Yes,Yes,A mix: some exact and relative p-value(s),p < .001,"Yes (e.g., total and group sample sizes provided)",112,No,All agreed on 'other' based on health and PA. WA agreed on full support based on review. RT had some typos. All agreed on mix and p<0.001. WA agreed on 112.
4/12/21 11:23,4/12/21 11:34,Rosie Twomey,EJSS,Polito,17461391.2019.1596166,Caffeine and resistance exercise: the effects of two caffeine doses and the influence of individual perception of caffeine,Applied exercise physiology (human),No,No,,,,,No,No,No,,No,,No,Yes,Yes,Yes,Yes,A mix: some exact and relative p-value(s),p <.01,"Yes (e.g., total and group sample sizes provided)",14,No,CM agreed on p values (coding for highest precision).
4/12/21 18:45,4/12/21 18:59,Rosie Twomey,EJSS,da Silva Rolim,10.1080/17461391.2018.1532532,Caffeine increases parasympathetic reactivation without altering resting and exercise cardiac parasympathetic modulation: A balanced placebo design,Applied exercise physiology (human),No,No,,,,,Yes,No,No,,No,,No,Yes,Yes,Yes,Yes,A mix: some exact and relative p-value(s),p < .001,"Yes (e.g., total and group sample sizes provided)",21,No,Coding as an RCT but note this is crossover. Mix due to 2 dp.
4/12/21 18:59,4/12/21 19:10,Rosie Twomey,EJSS,Naves,10.1080/17461391.2018.1548650,Cardiorespiratory and perceptual responses of two interval training and a continuous training protocol in healthy young men,Applied exercise physiology (human),No,No,,,,,Yes,No,No,,No,,No,Yes,Yes,Yes,Yes,"Relative (e.g., p < .05)",p <.05,"Yes (e.g., total and group sample sizes provided)",10,Yes,Copy & paste error corrected: manuscript title. CM agreed to code as RCT - crossover. RT typo on 10 analyzed.
4/12/21 19:14,4/12/21 19:23,Rosie Twomey,EJSS,Jiménez-Reyes,10.1080/17461391.2018.1542032,Changes in mechanical properties of sprinting during repeated sprint in elite rugby sevens athletes,Biomechanics,No,Yes,1,Partial support,"We hypothesise that the fatigue induced by a repeated sprint protocol would result in a decrease in practical performance measures, from an associated impairment of horizontal power output (Morin et al. 2011).","The main findings from this work show that the major decrease in sprint performance was associated with a substantial decrease in both v0 (–15,1%) and Pmax (–20.1%).",Yes,No,No,,No,,No,No,No,,,,,"Yes (e.g., total and group sample sizes provided)",20,No,WA and RT moved to partial based on the change in two variables (vo and pmax) rather than one (vo). RT agree on biomech.
4/12/21 19:23,4/12/21 19:30,Rosie Twomey,EJSS,Tanaka,10.1080/17461391.2018.1534991,Characteristics of lower leg and foot muscle thicknesses in sprinters: Does greater foot muscles contribute to sprint performance?,Sport performance,No,Yes,1,Full support,"Based on these findings, we hypothesised that sprinters may have not only developed lower limb muscles but also developed foot muscles because of enhancement of the role of MTP joint during sprinting.","The present study demonstrated that thicknesses of the foot muscles, in addition to the lower leg muscles, were larger in sprinters than in non-sprinters.",Yes,No,No,,No,,No,No,Yes,Yes,Yes,A mix: some exact and relative p-value(s),p <.05,"Yes (e.g., total and group sample sizes provided)",52,Yes,WM typo on sample size.
4/12/21 19:30,4/12/21 19:37,Rosie Twomey,EJSS,Moeijes,10.1080/17461391.2018.1510988,Characteristics of sports participation and psychosocial health in children: Results of a cross-sectional study,Sport/exercise psychology,No,No,,,,,Yes,No,No,,No,,No,No,Yes,Yes,Yes,"Exact (e.g., p = .049)",p < .001,"Yes (e.g., total and group sample sizes provided)",1768,No,All agreed on effect sizes. RT agreed on sci_cat. WA agreed on sample size. RT ask TL about p values (no relative but all 2 dp). Team leaders voted to code this as exact.
4/12/21 19:37,4/12/21 19:46,Rosie Twomey,EJSS,Ballester,10.1080/17461391.2019.1580318,"Chronic participation in externally paced, but not self-paced sports is associated with the modulation of domain-general cognition",Sport/exercise psychology,No,Yes,3,Partial support,"In the light of the non-sport-specific cognitive advantage of being an expert athlete (Voss et al., 2010), we expected better vigilance performance for both groups of athletes than for non-athletes.","No differences were found in PVT performance between the two athlete groups and between self-paced sports athletes and non-athletes, whereas athletes from externally-paced sports outperformed non-athletes. Crucially, athletes from externally-paced sports also differed from those of self-paced sports and non-athletes in the Oddball task, showing less omission and commission errors.",Yes,No,No,,No,,No,No,Yes,Yes,Yes,A mix: some exact and relative p-value(s),p < .001,"Yes (e.g., total and group sample sizes provided)",66,Yes,"WA moved to 3 hypotheses based on use of 'expect' and partial support based on review, and psychology. Agreed on mix and p<0.001."
4/12/21 21:08,4/12/21 21:31,Rosie Twomey,EJSS,Cui,10.1080/17461391.2019.1577494,Clustering tennis players’ anthropometric and individual features helps to reveal performance fingerprints,Sport performance,No,Yes,2,Partial support,"Based on previous literature, we hypothesised that players with taller height and more professional experience would have better match performance than other players.","""Their findings showed that players with higher relative quality and longer professional experience outperformed their peers during the match and achieved greater career success (Cui et al., 2017; Reid & Morris, 2013)."" ""Taller big-sized players and one-handed backhand players had overall better performance than their counterparts,""",Yes,No,No,,No,,No,No,Yes,Yes,Yes,A mix: some exact and relative p-value(s),p < .001,"Yes (e.g., total and group sample sizes provided)",189,No,"Professional experience is not discussed with height. Because there is no indication from the authors that this composite (this and this) hypothesis, we agreed on partial support. WA agreed on data. Agree with CM on sample size. Issue of pts vs. observations applies."
4/12/21 21:31,4/12/21 22:17,Rosie Twomey,EJSS,Leeder,10.1080/17461391.2019.1585478,Cold water immersion improves recovery of sprint speed following a simulated tournament,Sport performance,No,Yes,1,Not supported,"It was hypothesised that CWI in accordance with the majority of the literature to date, would be effective at reducing DOMS, but have no effect on other markers of recovery.","Cold water immersion was associated with attenuating the efflux of CK towards the latter end of the simulated tournament. Cold water immersion was ineffective in reducing markers of inflammation, oxidative stress or muscular soreness.",Yes,No,No,,No,,No,Yes,Yes,Yes,Yes,A mix: some exact and relative p-value(s),p < .001,"Yes (e.g., total and group sample sizes provided)",21,No,RT agreed with no support based on review. Agreed on p<0.001. Team leaders voted Sports Performance because team could not reach agreement. 
4/13/21 22:50,4/13/21 23:06,Rosie Twomey,EJSS,Maroto-Izquierdo,10.1080/17461391.2019.1588920,Comparison of the musculoskeletal effects of different iso-inertial resistance training modalities: Flywheel vs. electric-motor,Applied exercise physiology (human),No,Yes,1,Not supported,"Given the current options to produce EO during iso-inertial RT and the belief that greater EO during iso-inertial exercise may promote larger adaptations, we designed a study to investigate","Therefore, it seems that the magnitude of EO offered by either flywheel or motor-driven iso-inertial RT does not have a major impact on the resistance exerciseinduced muscle adaptations.",Yes,No,No,,No,,No,Yes,Yes,Yes,Yes,"Relative (e.g., p < .05)",p < .001,"Yes (e.g., total and group sample sizes provided)",40,No,Agree with RT on p values. WA agreef that belief = hypoth.
4/13/21 23:06,4/13/21 23:23,Rosie Twomey,EJSS,Gutiérrez-Davila,10.1080/17461391.2018.1539122,Components of attack response inhibition in fencing: Components of attack response inhibition in fencing,Biomechanics,No,Yes,1,Unclear or not stated,"it was hypothesized that SOA values &lt;200 ms would affect the motor execution of attack in fencing, thereby inducing the fencer to error.",UNCLEAR,No,No,No,,No,,No,No,Yes,Yes,Yes,"Relative (e.g., p < .05)",p < .001,"Yes (e.g., total and group sample sizes provided)",18,No,CM agreed on p values (coding for highest precision).
4/13/21 23:23,4/13/21 23:31,Rosie Twomey,EJSS,Duvnjak-Zaknich,10.1080/17461391.2018.1512653,Continuous and intermittent heat acclimation and decay in team sport athletes,"Environmental physiology (heat, cold, & altitude)",No,Yes,1,Full support,"It was hypothesised that there would be no difference between acclimation protocols in repeat-sprint performance in the heat or for decay, thereby making an INT approach a more ‘user-friendly’ method for use by team-sport players.","Practically, with no significant differences found between continuous and intermittent protocols, non-consecutive acclimation exposures may provide a more convenient (alternative) heat acclimation protocol.",Yes,No,No,,No,,No,Yes,Yes,Yes,Yes,A mix: some exact and relative p-value(s),p <.05,"Yes (e.g., total and group sample sizes provided)",16,Yes,CM agreed on RCT for randomized designs.
4/13/21 23:31,4/13/21 23:44,Rosie Twomey,EJSS,Ludyga,17461391.2018.1529826,Core executive functions are selectively related to different facets of motor competence in preadolescent children,Motor learning/control/behavior,No,Yes,2,Partial support,"Based on previous findings in the same age group, we expected high motor competences to be associated with high inhibitory control and working memory, but not high cognitive flexibility (Rigoli et al., 2012).","""Inhibitory control is not linked with locomotor skills"" ""locomotor skills were correlated with working memory"" ""Task-switching is not associated with any of the motor competences.""",Yes,No,No,,No,,No,No,Yes,Yes,Yes,A mix: some exact and relative p-value(s),p < .001,"Yes (e.g., total and group sample sizes provided)",89,Yes,WA agreed on partial support. Agree on p<0.001.
4/14/21 11:23,4/14/21 11:48,Rosie Twomey,EJSS,von Rosen,10.1080/17461391.2018.1552721,Correlates of health in adolescent elite athletes and adolescents: A crosssectional study of 1016 adolescents,Epidemiology,No,No,,,,,Yes,No,No,,No,,No,No,Yes,Yes,Yes,A mix: some exact and relative p-value(s),p < .001,"Yes (e.g., total and group sample sizes provided)",1016,Yes,
